{
  "schemaVersion": 1,
  "pairId": "WUSDT_USDC",
  "week": {
    "weekYear": 2026,
    "week": 26,
    "startsAt": "2026-06-22T00:00:00.000Z",
    "endsAt": "2026-06-29T00:00:00.000Z",
    "timeZone": "UTC"
  },
  "barIntervalMinutes": 10,
  "priceConvention": "USDC_PER_BASE",
  "disclaimer": "USDC is a token-denominated reference asset in this index. It is not fiat USD and this repository does not guarantee a USDC/USD peg.",
  "bars": [
    {
      "start": "2026-06-26T19:40:00.000Z",
      "end": "2026-06-26T19:50:00.000Z",
      "status": "empty",
      "eventCount": 0,
      "open": null,
      "high": null,
      "low": null,
      "close": null,
      "baseVolumeAtomic": "0",
      "quoteVolumeAtomic": "0"
    },
    {
      "start": "2026-06-26T19:50:00.000Z",
      "end": "2026-06-26T20:00:00.000Z",
      "status": "empty",
      "eventCount": 0,
      "open": null,
      "high": null,
      "low": null,
      "close": null,
      "baseVolumeAtomic": "0",
      "quoteVolumeAtomic": "0"
    },
    {
      "start": "2026-06-26T20:00:00.000Z",
      "end": "2026-06-26T20:10:00.000Z",
      "status": "empty",
      "eventCount": 0,
      "open": null,
      "high": null,
      "low": null,
      "close": null,
      "baseVolumeAtomic": "0",
      "quoteVolumeAtomic": "0"
    },
    {
      "start": "2026-06-26T20:10:00.000Z",
      "end": "2026-06-26T20:20:00.000Z",
      "status": "empty",
      "eventCount": 0,
      "open": null,
      "high": null,
      "low": null,
      "close": null,
      "baseVolumeAtomic": "0",
      "quoteVolumeAtomic": "0"
    },
    {
      "start": "2026-06-26T20:20:00.000Z",
      "end": "2026-06-26T20:30:00.000Z",
      "status": "empty",
      "eventCount": 0,
      "open": null,
      "high": null,
      "low": null,
      "close": null,
      "baseVolumeAtomic": "0",
      "quoteVolumeAtomic": "0"
    },
    {
      "start": "2026-06-26T20:30:00.000Z",
      "end": "2026-06-26T20:40:00.000Z",
      "status": "empty",
      "eventCount": 0,
      "open": null,
      "high": null,
      "low": null,
      "close": null,
      "baseVolumeAtomic": "0",
      "quoteVolumeAtomic": "0"
    },
    {
      "start": "2026-06-26T20:40:00.000Z",
      "end": "2026-06-26T20:50:00.000Z",
      "status": "empty",
      "eventCount": 0,
      "open": null,
      "high": null,
      "low": null,
      "close": null,
      "baseVolumeAtomic": "0",
      "quoteVolumeAtomic": "0"
    }
  ]
}
