{
  "schemaVersion": 1,
  "pairId": "USDT_USDC",
  "week": {
    "weekYear": 2026,
    "week": 26,
    "startsAt": "2026-06-22T00:00:00.000Z",
    "endsAt": "2026-06-29T00:00:00.000Z",
    "timeZone": "UTC"
  },
  "barIntervalMinutes": 10,
  "priceConvention": "USDC_PER_BASE",
  "disclaimer": "USDC is a token-denominated reference asset in this index. It is not fiat USD and this repository does not guarantee a USDC/USD peg.",
  "bars": [
    {
      "start": "2026-06-26T19:40:00.000Z",
      "end": "2026-06-26T19:50:00.000Z",
      "status": "filled",
      "eventCount": 14,
      "open": "0.999223988764",
      "high": "0.999224",
      "low": "0.999085977011",
      "close": "0.9990859887",
      "baseVolumeAtomic": "551700000",
      "quoteVolumeAtomic": "551234575"
    },
    {
      "start": "2026-06-26T19:50:00.000Z",
      "end": "2026-06-26T20:00:00.000Z",
      "status": "filled",
      "eventCount": 19,
      "open": "0.999085991983",
      "high": "0.999224",
      "low": "0.999085975232",
      "close": "0.999085994318",
      "baseVolumeAtomic": "728200000",
      "quoteVolumeAtomic": "727584621"
    },
    {
      "start": "2026-06-26T20:00:00.000Z",
      "end": "2026-06-26T20:10:00.000Z",
      "status": "filled",
      "eventCount": 15,
      "open": "0.999085985748",
      "high": "0.999224",
      "low": "0.999085980861",
      "close": "0.999086",
      "baseVolumeAtomic": "600700000",
      "quoteVolumeAtomic": "600188808"
    },
    {
      "start": "2026-06-26T20:10:00.000Z",
      "end": "2026-06-26T20:20:00.000Z",
      "status": "filled",
      "eventCount": 13,
      "open": "0.999223991416",
      "high": "0.999224",
      "low": "0.999085978835",
      "close": "0.999085978835",
      "baseVolumeAtomic": "510000000",
      "quoteVolumeAtomic": "509571307"
    },
    {
      "start": "2026-06-26T20:20:00.000Z",
      "end": "2026-06-26T20:30:00.000Z",
      "status": "filled",
      "eventCount": 12,
      "open": "0.999223991769",
      "high": "0.999224",
      "low": "0.999085975232",
      "close": "0.999223980815",
      "baseVolumeAtomic": "502600000",
      "quoteVolumeAtomic": "502176472"
    },
    {
      "start": "2026-06-26T20:30:00.000Z",
      "end": "2026-06-26T20:40:00.000Z",
      "status": "filled",
      "eventCount": 16,
      "open": "0.999085995975",
      "high": "0.999223994638",
      "low": "0.999085979899",
      "close": "0.99908598778",
      "baseVolumeAtomic": "663400000",
      "quoteVolumeAtomic": "662836494"
    },
    {
      "start": "2026-06-26T20:40:00.000Z",
      "end": "2026-06-26T20:50:00.000Z",
      "status": "filled",
      "eventCount": 12,
      "open": "0.999224",
      "high": "0.999224",
      "low": "0.999085981308",
      "close": "0.99922398305",
      "baseVolumeAtomic": "454500000",
      "quoteVolumeAtomic": "454120366"
    }
  ]
}
